{
    "root_path" : "../../../shaders",
    "shaders" : {
        "color" : "color-sdr",
        "bezel" : "bezel-sdr"
    },
    "textures" : [
        "BORDER"
    ],
    "options" : {
        "bezel": {
            "filter_linear" : true,
            "scale_type" : ["viewport"]
        }
    },
    "texture_options" : {
        "BORDER": {
            "linear": true,
            "mipmap": true,
            "wrap_mode": "clamp_to_edge"
        }
    }
}